{
  "schema_version": 1,
  "fixture_set_id": "audio-marker-probe-harness-fixtures-v1",
  "schema_ref": "schemas/audio-marker-probe-harness.schema.json",
  "generated_from": [
    "vault:20-projects/hapax-research/specs/2026-04-29-audio-reference-world-surface.md",
    "vault-task:audio-marker-probe-harness",
    "shared:audio_world_surface_fixtures",
    "shared:audio_world_surface_health"
  ],
  "declared_at": "2026-04-30T12:00:00Z",
  "producer": "cx-blue",
  "required_fixture_cases": [
    "dry_run_public_plan_only",
    "public_marker_witnessed",
    "private_marker_witnessed_no_leak",
    "no_leak_clean",
    "private_marker_leaked_public_negative",
    "live_execution_blocked_without_authorization",
    "commanded_without_marker"
  ],
  "marker_probe_kinds": ["public", "private", "no_leak"],
  "modes": ["dry_run", "fixture", "live"],
  "states": ["dry_run_planned", "witnessed", "blocked", "failed"],
  "probes": [
    {
      "schema_version": 1,
      "fixture_case": "dry_run_public_plan_only",
      "probe_id": "audio.marker.public.dry_run_plan",
      "probe_kind": "public",
      "mode": "dry_run",
      "surface_id": "audio.broadcast_voice",
      "semantic_destination": "broadcast_public",
      "marker_id": "public-marker-fixture-001",
      "marker_label": "public broadcast marker fixture",
      "target_ref": "pipewire:role-broadcast",
      "route_ref": "route:broadcast.voice",
      "witness_class": "public_audio_witness",
      "source_refs": [
        "audio-fixture:audio.broadcast_voice",
        "wcs-registry:audio.broadcast_voice"
      ],
      "evidence_refs": [],
      "freshness_window_s": 30,
      "confidence": 0.0,
      "required_for_public_claim": true,
      "live_execution_requested": false,
      "observation": {
        "route_present": false,
        "playback_present": false,
        "egress_audible": null,
        "marker_seen_on_public_paths": [],
        "marker_seen_on_private_targets": [],
        "private_marker_seen_on_public_paths": [],
        "leak_scan_completed": false,
        "observed_at": null
      },
      "expected_state": "dry_run_planned",
      "expected_health_state": "unknown",
      "expected_failure_class": "dry_run_not_runtime_witness",
      "expected_public_claim_allowed": false,
      "expected_private_only": false
    },
    {
      "schema_version": 1,
      "fixture_case": "public_marker_witnessed",
      "probe_id": "audio.marker.public.broadcast_egress",
      "probe_kind": "public",
      "mode": "fixture",
      "surface_id": "audio.broadcast_voice",
      "semantic_destination": "broadcast_public",
      "marker_id": "public-marker-fixture-002",
      "marker_label": "public broadcast marker fixture",
      "target_ref": "pipewire:hapax-livestream",
      "route_ref": "route:broadcast.voice",
      "witness_class": "public_audio_witness",
      "source_refs": [
        "audio-fixture:audio.broadcast_voice",
        "shm:hapax-daimonion/voice-output-witness.json",
        "shm:hapax-broadcast/audio-safe-for-broadcast.json"
      ],
      "evidence_refs": [
        "evidence:voice_output_witness",
        "evidence:broadcast_egress_marker"
      ],
      "freshness_window_s": 180,
      "confidence": 0.91,
      "required_for_public_claim": true,
      "live_execution_requested": false,
      "observation": {
        "route_present": true,
        "playback_present": true,
        "egress_audible": true,
        "marker_seen_on_public_paths": ["pipewire:hapax-livestream"],
        "marker_seen_on_private_targets": [],
        "private_marker_seen_on_public_paths": [],
        "leak_scan_completed": true,
        "observed_at": "2026-04-30T12:00:10Z"
      },
      "expected_state": "witnessed",
      "expected_health_state": "safe",
      "expected_failure_class": null,
      "expected_public_claim_allowed": true,
      "expected_private_only": false
    },
    {
      "schema_version": 1,
      "fixture_case": "private_marker_witnessed_no_leak",
      "probe_id": "audio.marker.private.assistant_monitor",
      "probe_kind": "private",
      "mode": "fixture",
      "surface_id": "audio.private_assistant_monitor",
      "semantic_destination": "private_assistant",
      "marker_id": "private-marker-fixture-001",
      "marker_label": "private assistant marker fixture",
      "target_ref": "pipewire:hapax-private-monitor-capture",
      "route_ref": "route:private.assistant_monitor",
      "witness_class": "private_audio_witness",
      "source_refs": [
        "audio-fixture:audio.private_assistant_monitor",
        "shm:hapax-daimonion/voice-output-witness.json"
      ],
      "evidence_refs": [
        "evidence:private-monitor-target",
        "evidence:private-marker",
        "evidence:broadcast-clean"
      ],
      "freshness_window_s": 180,
      "confidence": 0.88,
      "required_for_public_claim": false,
      "live_execution_requested": false,
      "observation": {
        "route_present": true,
        "playback_present": true,
        "egress_audible": null,
        "marker_seen_on_public_paths": [],
        "marker_seen_on_private_targets": ["pipewire:hapax-private-monitor-capture"],
        "private_marker_seen_on_public_paths": [],
        "leak_scan_completed": true,
        "observed_at": "2026-04-30T12:00:11Z"
      },
      "expected_state": "witnessed",
      "expected_health_state": "safe",
      "expected_failure_class": null,
      "expected_public_claim_allowed": false,
      "expected_private_only": true
    },
    {
      "schema_version": 1,
      "fixture_case": "no_leak_clean",
      "probe_id": "audio.marker.no_leak.clean",
      "probe_kind": "no_leak",
      "mode": "fixture",
      "surface_id": "audio.no_private_leak",
      "semantic_destination": "no_private_leak",
      "marker_id": "private-marker-fixture-001",
      "marker_label": "no leak marker fixture",
      "target_ref": "policy:no-private-leak",
      "route_ref": "route:private.assistant_monitor",
      "witness_class": "no_leak_audio_witness",
      "source_refs": [
        "audio-fixture:audio.no_private_leak",
        "shm:hapax-broadcast/audio-safe-for-broadcast.json"
      ],
      "evidence_refs": [
        "evidence:private-route-isolation",
        "evidence:broadcast-egress-clean"
      ],
      "freshness_window_s": 180,
      "confidence": 0.9,
      "required_for_public_claim": false,
      "live_execution_requested": false,
      "observation": {
        "route_present": true,
        "playback_present": true,
        "egress_audible": null,
        "marker_seen_on_public_paths": [],
        "marker_seen_on_private_targets": ["pipewire:hapax-private-monitor-capture"],
        "private_marker_seen_on_public_paths": [],
        "leak_scan_completed": true,
        "observed_at": "2026-04-30T12:00:12Z"
      },
      "expected_state": "witnessed",
      "expected_health_state": "safe",
      "expected_failure_class": null,
      "expected_public_claim_allowed": false,
      "expected_private_only": false
    },
    {
      "schema_version": 1,
      "fixture_case": "private_marker_leaked_public_negative",
      "probe_id": "audio.marker.no_leak.private_leak_negative",
      "probe_kind": "no_leak",
      "mode": "fixture",
      "surface_id": "audio.no_private_leak",
      "semantic_destination": "no_private_leak",
      "marker_id": "private-marker-fixture-002",
      "marker_label": "negative private leak marker fixture",
      "target_ref": "policy:no-private-leak",
      "route_ref": "route:private.assistant_monitor",
      "witness_class": "no_leak_audio_witness",
      "source_refs": [
        "audio-fixture:audio.no_private_leak",
        "shm:hapax-daimonion/voice-output-witness.json"
      ],
      "evidence_refs": [
        "evidence:private-marker",
        "evidence:broadcast-egress-marker"
      ],
      "freshness_window_s": 180,
      "confidence": 0.95,
      "required_for_public_claim": false,
      "live_execution_requested": false,
      "observation": {
        "route_present": true,
        "playback_present": true,
        "egress_audible": true,
        "marker_seen_on_public_paths": [],
        "marker_seen_on_private_targets": ["pipewire:hapax-private-monitor-capture"],
        "private_marker_seen_on_public_paths": ["pipewire:hapax-voice-fx-capture"],
        "leak_scan_completed": true,
        "observed_at": "2026-04-30T12:00:13Z"
      },
      "expected_state": "failed",
      "expected_health_state": "unsafe",
      "expected_failure_class": "private_marker_leaked_public",
      "expected_public_claim_allowed": false,
      "expected_private_only": false
    },
    {
      "schema_version": 1,
      "fixture_case": "live_execution_blocked_without_authorization",
      "probe_id": "audio.marker.private.live_blocked_unauthorized",
      "probe_kind": "private",
      "mode": "live",
      "surface_id": "audio.private_assistant_monitor",
      "semantic_destination": "private_assistant",
      "marker_id": "private-marker-live-guard",
      "marker_label": "live private marker guard",
      "target_ref": "pipewire:hapax-private-monitor-capture",
      "route_ref": "route:private.assistant_monitor",
      "witness_class": "private_audio_witness",
      "source_refs": [
        "audio-fixture:audio.private_assistant_monitor",
        "guard:private-voice-hard-stop",
        "guard:cx-red-operator-authorization"
      ],
      "evidence_refs": [],
      "freshness_window_s": 30,
      "confidence": 0.0,
      "required_for_public_claim": false,
      "live_execution_requested": true,
      "observation": {
        "route_present": true,
        "playback_present": true,
        "egress_audible": null,
        "marker_seen_on_public_paths": [],
        "marker_seen_on_private_targets": ["pipewire:hapax-private-monitor-capture"],
        "private_marker_seen_on_public_paths": [],
        "leak_scan_completed": true,
        "observed_at": null
      },
      "expected_state": "blocked",